IDQuest,Category,Question,ChoiceA,ChoiceB,CorectAnswer
1,QTF,"System.in is the input stream connected to the console,",TRUE,FALSE,ChoiceA
2,QTF,String is primitive data type,TRUE,FALSE,ChoiceB
3,QTF,Is JRE (Java Runtime Environment) an implementation of JVM (Java Virtual Machine)?,TRUE,FALSE,ChoiceA
4,QTF,Is 6/2 * 3 >= 7 ?,TRUE,FALSE,ChoiceB
5,QTF,Is (3*5 >= 12) && (3*4 < 12)?,TRUE,FALSE,ChoiceB
6,QTF,A static method can refer to any instance variable of the class.,TRUE,FALSE,ChoiceB
7,QTF,"Java does not allow a method with the same signature in a subclass, as a method in the superclass.",TRUE,FALSE,ChoiceB
8,QTF,A method declaration must always contain the access level.,TRUE,FALSE,ChoiceB
9,QTF,The access level of an overridden method cannot be changed in a subclass.,TRUE,FALSE,ChoiceB